{
  "$schema": "./mobile-app.schema.json",
  "contractVersion": 3,
  "appId": "com.tamhoanq.korean",
  "appName": "Tiếng Hàn - TamHoanq",
  "webDir": "www",
  "nativeWrapper": "capacitor-8.5.1",
  "platforms": {
    "android": { "enabled": true, "status": "generated-in-ci", "minimumApi": 24 },
    "ios": { "enabled": true, "status": "generated-in-ci", "minimumVersion": "15" }
  },
  "bridge": {
    "notifications": "MobileNotificationService",
    "offlinePacks": "MobileOfflineService",
    "backgroundAudio": "BackgroundAudioService",
    "camera": "MobileCameraService",
    "widget": "MobileWidgetService",
    "shortcuts": "AppShortcutService",
    "auth": "NativeAuthBridge",
    "sync": "NativeSyncBridge",
    "microphone": "MobileMicrophoneExperienceService",
    "biometric": "NativeBiometricService",
    "deepLinks": "NativeDeepLinkService",
    "storage": "MobileDownloadManagerService",
    "analytics": "MobileAnalyticsService",
    "vocabularyImmersion": "VocabularyMasteryBridgeService"
  },
  "api": {
    "resolver": "KLearnPlatform.apiUrl",
    "releaseEnvironment": "MOBILE_API_BASE_URL",
    "cleartextAllowed": false
  },
  "identity": {
    "provider": "Supabase",
    "flow": "PKCE",
    "deepLink": "com.tamhoanq.korean://auth/callback",
    "sharedWithWeb": true
  },
  "offline": {
    "content": ["lesson", "vocabulary", "audio", "practice"],
    "progressQueue": "BackgroundSyncQueueService",
    "reconnect": "CloudSyncService"
  },
  "releaseChannels": ["internal", "beta", "production"],
  "security": {
    "allowCleartext": false,
    "authSessionStorage": "native-keychain-or-keystore",
    "biometricDataStored": false,
    "cameraProcessing": "on-device",
    "notificationPermission": "user-initiated",
    "privateDataInWebCache": false,
    "certificatePolicy": "system-trust-https-only"
  }
}
